{
  "meta": {
    "collectedAt": "2026-01-01T00:00:00+00:00",
    "hostname": "example.local",
    "source": "collect-mac-state.py",
    "scriptVersion": "1.3.0",
    "inventoryDigest": "1b8f21331db6fffe166c8c7a6543c32aae0c4402fe83f9527af57dfa21853101"
  },
  "system": {
    "sw_vers": {
      "productName": "macOS",
      "productVersion": "15.0",
      "buildVersion": "24A000"
    },
    "uname": "Darwin example.local 24.0.0 Darwin Kernel Version 24.0.0 arm64",
    "arch": "arm64",
    "hardware": {
      "chip_type": "Apple M1",
      "physical_memory": "16 GB"
    },
    "shell": "/bin/zsh",
    "loginShell": "/bin/zsh"
  },
  "paths": {
    ".zshrc": true,
    ".profile": false
  },
  "homebrew": {
    "prefix": "/opt/homebrew",
    "version": "Homebrew 4.0.0",
    "taps": ["homebrew/core"],
    "formulaeInstalled": ["git"],
    "casksInstalled": [],
    "leaves": ["git"],
    "brewfile": null
  },
  "notes": []
}
